Q000A,"Acervo total de activos fijos. Es el valor actualizado de todos aquellos bienes, propiedad de la unidad económica –cuya vida útil es superior a un año– que tienen la capacidad de producir o proporcionar las condiciones necesarias para la generación de bienes y servicios. Incluye: los activos fijos propiedad de la unidad económica alquilados a terceros; los que utiliza normalmente, aun cuando sean asignados temporalmente a otras unidades económicas de la misma empresa; los que produce la unidad económica para uso propio y los activos fijos que obtuvo en arrendamiento financiero. Excluye: los activos fijos que utilizan normalmente otras unidades económicas de la misma empresa; los activos fijos en arrendamiento puro; las reparaciones menores de los activos fijos; los gastos por reparación y mantenimiento corriente. ",millones de pesos,float,15,De - 99999999999999 a 99999999999999 ó Null
Q000B," Depreciación total de activos fijos. Comprende la pérdida de valor durante el periodo de referencia, por el uso u obsolescencia de los activos fijos propiedad de la unidad económica.",millones de pesos,float,15,De - 99999999999999 a 99999999999999 ó Null
Q000C," Compras totales de activos fijos. Es el monto de las adquisiciones y transferencias recibidas de activos fijos a valor actual, nuevos o usados, que durante el periodo de referencia realizó la unidad económica, sumando todas las erogaciones en que incurrió para llevar e instalar los activos fijos en la unidad económica y su puesta en funcionamiento. Incluye: las mejoras, reformas y renovaciones de importancia que realizó la unidad económica en sus activos fijos para incrementar la productividad o vida útil de éstos y la producción de activos fijos para uso propio. Excluye: las reparaciones y mantenimiento corriente de los activos fijos.",millones de pesos,float,15,De - 99999999999999 a 99999999999999 ó Null
Q000D,"Ventas totales de activos fijos. Es el monto de las ventas realizadas durante el periodo de referencia, de los activos fijos que fueron propiedad de la unidad económica.",millones de pesos,float,15,De - 99999999999999 a 99999999999999 ó Null
Q010A,"Acervo total de maquinaria y equipo de producción. Es el valor actualizado o a costo de reposición el día 31 de diciembre del periodo de referencia, de la maquinaria y el equipo mecánico, eléctrico, computarizado o de otro tipo, propiedad de la unidad económica, vinculado directamente con sus procesos de producción, comercialización o prestación de servicios y tareas auxiliares, así como el equipo para el servicio de transporte de pasajeros y carga, la construcción, la explotación y extracción de minerales, embarcaciones, artes y equipo para la pesca y la acuicultura.",millones de pesos,float,15,De - 99999999999999 a 99999999999999 ó Null
Q020A,"Acervo total de bienes inmuebles. Es el valor actualizado a costo de reposición el día 31 de diciembre del periodo de referencia, de los edificios, locales, construcciones e instalaciones como pozos y plataformas marinas, ductos, estructuras y equipo de compresión, regulación y medición de hidrocarburos, de telecomunicaciones y otras construcciones, como plantas de tratamiento, obras de toma, líneas de conducción, propiedad de la unidad económica, que utilizó para el desarrollo de sus actividades; así como las áreas para estacionamiento, esparcimiento, áreas verdes, entre otras. Incluye: el valor de los terrenos, estén o no edificados, situados en la misma ubicación física de la unidad económica.",millones de pesos,float,15,De - 99999999999999 a 99999999999999 ó Null
Q030A,"Acervo total de unidades y equipo de transporte. Es el valor actualizado a costo de reposición el día 31 de diciembre del periodo de referencia, del equipo de transporte (vehículos automotores, aviones, barcos, etcétera) propiedad de la unidad económica, que utilizó para transportar personas o carga fuera de la misma. Excluye: el equipo necesario para transportar o levantar carga dentro de la unidad económica.",millones de pesos,float,15,De - 99999999999999 a 99999999999999 ó Null
Q400A,"Acervo total de equipo de cómputo y periféricos. Es el valor actualizado a costo de reposición del equipo de cómputo y sus periféricos, propiedad de la unidad económica, que no estaban integrados a la maquinaria y equipo de producción, como son las computadoras, redes de comunicación, impresoras, digitalizadores, entre otros. Excluye: el software.",millones de pesos,float,15,De - 99999999999999 a 99999999999999 ó Null
Q900A,"Acervo total de mobiliario, equipo de oficina y otros activos fijos. Es el valor actualizado a costo de reposición del mobiliario, equipo de oficina y otros bienes de capital propiedad de la unidad económica, cuya vida útil sea mayor a un año y que proporcionaron las condiciones necesarias para llevar a cabo la actividad productiva de la unidad económica.",millones de pesos,float,15,De - 99999999999999 a 99999999999999 ó Null
